<?xml version="1.0" encoding="UTF-8"?>
<database xmlns="http://stano.com/database"
          xmlns:xsi="http://www.w3.org/2001/XMLSchema-instance"
          xsi:schemaLocation="http://stano.com/database http://schema.stano.com/schema.xsd">
    <table name="users">
        <columns>
            <column name="id" type="sequence" required="true"/>
            <column name="name" type="varchar" length="100" required="true"/>
            <column name="email" type="varchar" length="100"/>
        </columns>
        <keys>
            <primary>
                <column name="id"/>
            </primary>
        </keys>
    </table>
</database>
